καθέζομαι (καθίζω)	sit down	καί ῥα πάροιθ' αὐτοῖο καθέζετο δάκρυ χέοντος,	1.360
καθεύδω, καθευδήσω*	sleep, slumber, rest (in bed), lie (in bed)	ἔνθα καθεῦδ' ἀναβάς, παρὰ δὲ χρυσόθρονος Ἥρη.	1.611
καθῆμαι	sit down, be seated	καί ῥ ἀκέουσα καθῆστο ἐπιγνάμψασα φίλον κῆρ:	1.569
καί	and, also, even	Ἀτρεΐδης τε ἄναξ ἀνδρῶν καὶ δῖος Ἀχιλλεύς.	1.7
καίω, καύσω, ἔκηα	burn, consume	βάλλ': αἰεὶ δὲ πυραὶ νεκύων καίοντο θαμειαί.	1.52
κάκιστος, η, ον	worst (superlative of κακός)		
κακίων, ον	worse (comparative of κακός)		
κακός, ή, όν	bad, poor, ugly, evil, wicked, cowardly	νοῦσον ἀνὰ στρατὸν ὄρσε κακήν, ὀλέκοντο δὲ λαοί,	1.10
κακότης, ητος, ἡ	badness	ἦ ἀνδρῶν κακότητι καὶ ἀφραδίῃ πολέμοιο.	2.368
κακῶς	evilly, wickedly, harshly, with evil consequences	ἀλλὰ κακῶς ἀφίει, κρατερὸν δ' ἐπὶ μῦθον ἔτελλε:	1.25
καλέω, καλέω, ἐκάλεσ(σ)α	call, summon, convoke	τῇ δεκάτῃ δ' ἀγορὴν δὲ καλέσσατο λαὸν Ἀχιλλεύς:	1.54
καλλιπάρῃος, ον	beautiful-cheeked, fair-cheeked	θείομεν, ἂν δ' αὐτὴν Χρυσηΐδα καλλιπάρῃον	1.143
καλλίων, ον	better (comparative of καλός)		
κᾱλός, ή, όν	good, noble, handsome, brave, fair, beautiful	καλὸν ἀείδοντες παιήονα κοῦροι Ἀχαιῶν	1.473
καλύπτω, καλύψω, ἐκάλυψα, --, κεκάλυμμαι, ἐκαλύφθην	cover, conceal, hide, envelop	μηρούς τ' ἐξέταμον κατά τε κνίσῃ ἐκάλυψαν	1.460
Κάλχας, Κάλχαντος, ὁ	Calchas		
κάμνω, καμέομαι, ἔκαμον, κέκμη(κ)α	do, make, toil, be weary, suffer, accomplish with pain	ἔρχομ' ἔχων ἐπὶ νῆας, ἐπεί κε κάμω πολεμίζων.	1.168
καπνίζω, κάπνισσαν	smoke, blacken with smoke	κάπνισσάν τε κατὰ κλισίας, καὶ δεῖπνον ἕλοντο.	2.399
καπνός, οῦ, ὁ	smoke, vapour, mist, fume	κνίση δ' οὐρανὸν ἷκεν ἑλισσομένη περὶ καπνῷ.	1.317
κάρη, κρατός (κάρητος), τό	head, peak, summit	θωρῆξαί ἑ κέλευε κάρη κομόωντας Ἀχαιοὺς	2.11
κάρηνον, ου, τό	peak, summit, headland, citadel	βῆ δὲ κατ' Οὐλύμποιο καρήνων χωόμενος κῆρ,	1.44
καρπαλίμως	quickly, suddenly, swiftly	καρπαλίμως δ' ἀνέδυ πολιῆς ἁλὸς ἠΰτ' ὀμίχλη,	1.359
καρπός, οῦ, ὁ	fruit, crop, produce, harvest	καρπὸν ἐδηλήσαντ', ἐπεὶ ἦ μάλα πολλὰ μεταξὺ	1.156
κατά / κάδ	down (from), down over, down through, according to, on	βῆ δὲ κατ' Οὐλύμποιο καρήνων χωόμενος κῆρ,	1.44
καταδύω, καταδύσω, κατέδυσα (κατέδυν), καταδέδυκα	go down, sink, set, dive	ἦμος δ' ἠέλιος κατέδυ καὶ ἐπὶ κνέφας ἦλθε,	1.475
κατακαίω, κατακαύσω, κατέκηα	burn (down), consume	ἢ εἰ δή ποτέ τοι κατὰ πίονα μηρί' ἔκηα	1.40
κατακείω	desire to lie down (rest, repose, slumber)	οἳ μὲν κακκείοντες ἔβαν οἶκον δὲ ἕκαστος,	1.606
κατακοιμάω	pass the night, sleep	πρίν τινα πὰρ Τρώων ἀλόχῳ κατακοιμηθῆναι,	2.355
καταλύω	put down, destroy	ὃς δὴ πολλάων πολίων κατέλυσε κάρηνα	2.117
κατανεύω, κατανεύσω, κατένευσα	nod (down), assent	νημερτὲς μὲν δή μοι ὑπόσχεο καὶ κατάνευσον	1.514
καταπέσσω, καταπέψω, κατέπεψα	digest, repress, cook	εἴ περ γάρ τε χόλον γε καὶ αὐτῆμαρ καταπέψῃ,	1.81
καταπίπτω, καταπεσέομαι, κατέπεσον, καταπέπτη(κ)α	fall, drop	κάππεσον ἐν Λήμνῳ, ὀλίγος δ' ἔτι θυμὸς ἐνῆεν:	1.593
καταρέζω, καταρέξω, κατέ(ρ)ρεξα, --, --, κατερέχθην	caress, stroke, fondle	χειρί τέ μιν κατέρεξεν ἔπος τ' ἔφατ' ἔκ τ' ὀνόμαζε:	1.361
κατεσθίω, κατέδομαι, κατέφαγον,* κατεδήδοκα,* κατεδήδεσμα,* κατηδέσθην*	devour, eat up	ἔνθ' ὅ γε τοὺς ἐλεεινὰ κατήσθιε τετριγῶτας:	2.314
κατίσχω	hold back, (med.) keep by one, possess	ἥν τ' αὐτὸς ἀπονόσφι κατίσχεαι; οὐ μὲν ἔοικεν	2.233
κέ(ν), ἄν	haply, perchance, perhaps	ἂψ ἀπονοστήσειν, εἴ κεν θάνατόν γε φύγοιμεν,	1.60
κεῖμαι, κείσομαι	lie, recline, repose	οὐδέ τί που ἴδμεν ξυνήϊα κείμενα πολλά:	1.124
κελαινεφής, ές	wrapped in black clouds	εὐχομένης ὅτ' ἔφησθα κελαινεφέϊ Κρονίωνι	1.397
κελαινός, ή, όν	black, dark, dusky	αἶψά τοι αἷμα κελαινὸν ἐρωήσει περὶ δουρί.	1.303
κέλευθος, ου, ὁ (κέλευθα, ων, τά)	road, way, path, journey, route	οἳ μὲν ἔπειτ' ἀναβάντες ἐπέπλεον ὑγρὰ κέλευθα,	1.312
κέλομαι, κελήσομαι, ἐκελησάμην* (ἐκεκλόμην)	urge, command, bid, request	ὦ Ἀχιλεῦ κέλεαί με Διῒ φίλε μυθήσασθαι	1.74
κενός, ή, όν	empty	αἰσχρόν τοι δηρόν τε μένειν κενεόν τε νέεσθαι.	2.298
κερδαλεόφρων, ον	crafty-minded, cunning(-minded), sly, mindful of gain	ὤ μοι ἀναιδείην ἐπιειμένε κερδαλεόφρον	1.149
κερτομέω	taunt, sneer	ἥρωες Δαναοί: σὺ δὲ κερτομέων ἀγορεύεις.	2.256
κερτόμιος, η, ον	biting, cutting, sharp, bitter, contemptuous	αὐτίκα κερτομίοισι Δία Κρονίωνα προσηύδα:	1.539
κεύθω, κεύσω, ἔκευσα (ἔκυθον, κέκυθον), κέκευθα	hide, conceal, enclose	ἐξαύδα, μὴ κεῦθε νόῳ, ἵνα εἴδομεν ἄμφω.	1.363
κεφαλή, ής, ἡ	head	εἰ δ' ἄγε τοι κεφαλῇ κατανεύσομαι ὄφρα πεποίθῃς:	1.524
κῆδος, εος, τό	woe, grief, suffering	Ἥρη λισσομένη, Τρώεσσι δὲ κήδε' ἐφῆπται.	2.15
κήδω, κηδήσω, ἐκήδησα*	grieve, distress, hurt, afflict (with gen)	κήδετο γὰρ Δαναῶν, ὅτι ῥα θνήσκοντας ὁρᾶτο.	1.56
κῆλον, ου, τό	(divine) arrow, shaft, dart	ἐννῆμαρ μὲν ἀνὰ στρατὸν ᾤχετο κῆλα θεοῖο,	1.53
κήρ, κήρος, ἡ	death, fate	τέτληκας θυμῷ: τὸ δέ τοι κὴρ εἴδεται εἶναι.	1.228
κῆρ, κῆρος, τό	heart, soul	βῆ δὲ κατ' Οὐλύμποιο καρήνων χωόμενος κῆρ,	1.44
κῆρυξ, υκος, ὁ	herald	τώ οἱ ἔσαν κήρυκε καὶ ὀτρηρὼ θεράποντε:	1.321
κηρύσσω	summon, proclaim	οἳ μὲν ἐκήρυσσον, τοὶ δ' ἠγείροντο μάλ' ὦκα:	2.52
κικλήσκω	call, summon, invoke	κίκλησκεν δὲ γέροντας ἀριστῆας Παναχαιῶν,	2.404
Κίλλα, ης, ἡ	Cilla		
κινέω*, κινήσω*, ἐκίνησα	move, stir, move oneself, go, come, set in motion, disturb	αὐτοῦ κινηθέντος: ὃ δ' ἤϊε νυκτὶ ἐοικώς.	1.47
κιχάνω (κιχ-, κιχε-), κιχήσομαι, ἐκιχησάμην (ἔκιχον, ἐκίχην)	come upon, overtake, arrive (at)	μή σε γέρον κοίλῃσιν ἐγὼ παρὰ νηυσὶ κιχείω	1.26
κίω	come, go, depart	πολλὰ δ' ἔπειτ' ἀπάνευθε κιὼν ἠρᾶθ' ὃ γεραιὸς	1.35
κλαγγή, ῆς, ἡ	clang, uproar, roar, noise	δεινὴ δὲ κλαγγὴ γένετ' ἀργυρέοιο βιοῖο:	1.49
κλάζω, κλάγξω*, ἔκλαγξα (ἔκλαγον), κέκληγα	roar, shriek, resound	ἔκλαγξαν δ' ἄρ' ὀϊστοὶ ἐπ' ὤμων χωομένοιο,	1.46
κλαίω, κλαύσομαι, ἔκλαυσα	cry, weep	τέκνον τί κλαίεις; τί δέ σε φρένας ἵκετο πένθος;	1.362
κλέπτω, κλέψω, ἔκλεψα	steal, be stealthy, deceive, hide	κλέπτε νόῳ, ἐπεὶ οὐ παρελεύσεαι οὐδέ με πείσεις.	1.132
κλεύω, ---, ἔκλυον	hear, hearken to (with gen)	κλῦθί μευ ἀργυρότοξ', ὃς Χρύσην ἀμφιβέβηκας	1.37
κλισίη, ης, ἡ	hut, barrack, tent	αὐτὸς ἰὼν κλισίην δὲ τὸ σὸν γέρας ὄφρ' ἐῢ εἰδῇς	1.185
Κλυταιμ(ν)ήστρη, ης, ἡ	Clytaemnestra		
κλυτοτέχνης, ες	renowned for skill in handicraft	τοῖσιν δ' Ἥφαιστος κλυτοτέχνης ἦρχ' ἀγορεύειν	1.571
κνέφας, αος, τό	darkness, night, gloom	ἦμος δ' ἠέλιος κατέδυ καὶ ἐπὶ κνέφας ἦλθε,	1.475
κνίση, ης, ἡ	fat, savour, odour of roast meat	αἴ κέν πως ἀρνῶν κνίσης αἰγῶν τε τελείων	1.66
κοῖλος, η, ον	hollow	μή σε γέρον κοίλῃσιν ἐγὼ παρὰ νηυσὶ κιχείω	1.26
κοιμάω, κοιμήσω, ἐκοίμησα, --, --, ἐκοιμήθην	(lull to) sleep, slumber, lie down	δὴ τότε κοιμήσαντο παρὰ πρυμνήσια νηός:	1.476
κοιρανέω	be lord or master, rule, command; to play the master	ὣς ὅ γε κοιρανέων δίεπε στρατόν: οἳ δ' ἀγορὴν δὲ	2.207
κοίρανος, -ου, ὁ	ruler, leader, commander	οὐκ ἀγαθὸν πολυκοιρανίη: εἷς κοίρανος ἔστω,	2.204
κολεόν (κουλεόν), οῦ, τό	sheath, scabbard	ἕλκετο δ' ἐκ κολεοῖο μέγα ξίφος, ἦλθε δ' Ἀθήνη	1.194
κολῳάω	brawl, scold	Θερσίτης δ' ἔτι μοῦνος ἀμετροεπὴς ἐκολῴα,	2.212
κολῳός, οῦ, ὁ	brawl, wrangling, quarrel	ἐν δὲ θεοῖσι κολῳὸν ἐλαύνετον: οὐδέ τι δαιτὸς	1.575
κομάω	let the hair grow long	θωρῆξαί ἑ κέλευε κάρη κομόωντας Ἀχαιοὺς	2.11
κόμη, ης, ἡ	hair, locks, tresses	στῆ δ' ὄπιθεν, ξανθῆς δὲ κόμης ἕλε Πηλεΐωνα	1.197
κομίζω, κομιῶ, ἐκόμισ(σ)α	bear, care for, attend, accompany	ἔνθά με Σίντιες ἄνδρες ἄφαρ κομίσαντο πεσόντα.	1.594
κοναβέω	resound, clash, re-echo	σμερδαλέον κονάβησαν ἀϋσάντων ὑπ' Ἀχαιῶν,	2.334
κονίη, -ης, ἡ	dust	νῆας ἔπ' ἐσσεύοντο, ποδῶν δ' ὑπένερθε κονίη	2.150
κορύσσω, κεκόρυθμαι	fit out, equip, marshal	βουλάς τ' ἐξάρχων ἀγαθὰς πόλεμόν τε κορύσσων:	2.273
κορυφή, ῆς, ἡ	peak, summit, crest	ἀκροτάτῃ κορυφῇ πολυδειράδος Οὐλύμποιο:	1.499
κορωνίς, ίδος	curved, bent	οἴκαδ' ἴμεν σὺν νηυσὶ κορωνίσιν, οὐδέ σ' ὀΐω	1.170
κοσμήτωρ, ορος, ὁ	commander, marshaller	Ἀτρεΐδα δὲ μάλιστα δύω, κοσμήτορε λαῶν:	1.16
κοτέω, --, ἐκότεσ(σ)α, κεκότη(κ)α	hold a grudge, be angry, be vindictive	οὐδ' ὄθομαι κοτέοντος: ἀπειλήσω δέ τοι ὧδε:	1.181
κότος, ου, ὁ	grudge, rancour, hate	ἀλλά τε καὶ μετόπισθεν ἔχει κότον, ὄφρα τελέσσῃ,	1.82
κούρη, ης, ἡ	girl, maiden, young woman	πρίν γ' ἀπὸ πατρὶ φίλῳ δόμεναι ἑλικώπιδα κούρην	1.98
κουρίδιος, η, ον	lawfully wedded, wedded in youth	κουριδίης ἀλόχου, ἐπεὶ οὔ ἑθέν ἐστι χερείων,	1.114
κοῦρος, ου, ὁ	young man, noble	κοῦροι μὲν κρητῆρας ἐπεστέψαντο ποτοῖο,	1.470
κραδίη (καρδίη), ης, ἡ	heart (cardio)	οἰνοβαρές, κυνὸς ὄμματ' ἔχων, κραδίην δ' ἐλάφοιο,	1.225
κραιαίνω, ἐκρήηνα	accomplish, perform, fulfill	ταύρων ἠδ' αἰγῶν, τὸ δέ μοι κρήηνον ἐέλδωρ:	1.41
κρατερός, ή, όν	strong, harsh, powerful, stern, mighty	ἀλλὰ κακῶς ἀφίει, κρατερὸν δ' ἐπὶ μῦθον ἔτελλε:	1.25
κρατέω	rule, bear sway (with gen)	Ἀργείων κρατέει καί οἱ πείθονται Ἀχαιοί:	1.79
κράτιστος (κάρτιστος)	most powerful (superlative of κρατερός)	κάρτιστοι δὴ κεῖνοι ἐπιχθονίων τράφεν ἀνδρῶν:	1.266
κράτος, εος, τό	power, might, sway, rule, victory, strength, dominion	τόφρα δ' ἐπὶ Τρώεσσι τίθει κράτος ὄφρ' ἂν Ἀχαιοὶ	1.509
κρείσσων, ον	mightier, more powerful, better (comparative of κρατερός)	κρείσσων γὰρ βασιλεὺς ὅτε χώσεται ἀνδρὶ χέρηϊ:	1.80
κρείων, ουσα, ον	ruling, prince, ruler	ἥρως Ἀτρεΐδης εὐρὺ κρείων Ἀγαμέμνων	1.102
κρήγυος, η, ον	good, helpful, favourable, honest, true, truthful, useful	μάντι κακῶν οὐ πώ ποτέ μοι τὸ κρήγυον εἶπας:	1.106
κρήνη	well, spring, fountain	ἡμεῖς δ' ἀμφὶ περὶ κρήνην ἱεροὺς κατὰ βωμοὺς	2.305
κρητήρ, ῆρος, ὁ	mixing bowl	κοῦροι μὲν κρητῆρας ἐπεστέψαντο ποτοῖο,	1.470
κρίνω, κρινέω, ἔκρινα, κέκρικα**, κέκριμαι, ἐκρί(ν)θην	pick out, select, choose, discern, decide, judge	ἐν δ' ἐρέτας ἔκρινεν ἐείκοσιν, ἐς δ' ἑκατόμβην	1.309
κρυπτάδιος, η, ον	hidden, secret	κρυπτάδια φρονέοντα δικαζέμεν: οὐδέ τί πώ μοι	1.542
κτείνω, κτενέω, ἔκτεινα (ἔκταν[ον]), ἔκτονα*, --, ἐκτάθην	kill, slay, murder	κτεινομένους, ἵνα πάντες ἐπαύρωνται βασιλῆος,	1.410
κυάνεος, η, ον	dark (blue), black, dusky	ἦ καὶ κυανέῃσιν ἐπ' ὀφρύσι νεῦσε Κρονίων:	1.528
κυδιάνειρα	man-ennobling, bringing kudos to men	οὔτέ ποτ' εἰς ἀγορὴν πωλέσκετο κυδιάνειραν	1.490
κύδιστος, η, ον	most glorious	Ἀτρεΐδη κύδιστε φιλοκτεανώτατε πάντων,	1.122
κῦδος, εος, τό	glory, honour, renown	σκηπτοῦχος βασιλεύς, ᾧ τε Ζεὺς κῦδος ἔδωκεν.	1.279
κῦμα, ατος, τό	wave, billow	ἐν δ' ἄνεμος πρῆσεν μέσον ἱστίον, ἀμφὶ δὲ κῦμα	1.481
κυνώπης, αο (ου), ὁ	dog-faced, dog-eyed, shameless (one)	τιμὴν ἀρνύμενοι Μενελάῳ σοί τε κυνῶπα	1.159
κύπελλον, ου, τό	cup, goblet	μειδήσασα δὲ παιδὸς ἐδέξατο χειρὶ κύπελλον:	1.596
κυρτός, -ή, -όν	curved, arched	κυρτὼ ἐπὶ στῆθος συνοχωκότε: αὐτὰρ ὕπερθε	2.218
κύων, κυνός, ὁ, ἡ	dog	ἡρώων, αὐτοὺς δὲ ἑλώρια τεῦχε κύνεσσιν	1.4
κώπη, ης, ἡ	hilt, handle	ἦ καὶ ἐπ' ἀργυρέῃ κώπῃ σχέθε χεῖρα βαρεῖαν,	1.219
λᾶας, ος, ὁ/ἡ	stone	λᾶαν γάρ μιν ἔθηκε Κρόνου πάϊς ἀγκυλομήτεω:	2.319
λάβρος, -ον	furious, boisterous	λάβρος ἐπαιγίζων, ἐπί τ' ἠμύει ἀσταχύεσσιν,	2.148
λάζομαι	to seize, grasp, take	πρηνέες ἐν κονίῃσιν ὀδὰξ λαζοίατο γαῖαν.	2.418
λαμβάνω*, λήψομαι*, ἔλαβον	take, seize, lay hold of, accept	Ἀτρεΐωνα δ' ἔπειτα χόλος λάβεν, αἶψα δ' ἀναστὰς	1.387
λαμπετάω	shine, gleam, blaze, flame	πίμπλαντ', ὄσσε δέ οἱ πυρὶ λαμπετόωντι ἐΐκτην:	1.104
λαμπρός, ή, όν	bright, brilliant, shining, gleaming	αὐτὰρ ἐπεὶ κατέδυ λαμπρὸν φάος ἠελίοιο,	1.605
λᾱός, οῦ, ὁ	people, host, soldiery	νοῦσον ἀνὰ στρατὸν ὄρσε κακήν, ὀλέκοντο δὲ λαοί,	1.10
λάσιος, η, ον	hairy, shaggy, rough, bushy	στήθεσσιν λασίοισι διάνδιχα μερμήριξεν,	1.189
λάχνη, -ης, ἡ	soft, downy hair	φοξὸς ἔην κεφαλήν, ψεδνὴ δ' ἐπενήνοθε λάχνη.	2.219
λέγω, λέξω, ἔλεξα, *εἴλοχα, *εἴλεγμαι, ἐλέχθην	pick up, gather, (re-)count	Τρῶας μὲν λέξασθαι ἐφέστιοι ὅσσοι ἔασιν,	2.125
λείβω, --, ἔλειψα	pour a libation	λεῖβε: νέοι δὲ παρ' αὐτὸν ἔχον πεμπώβολα χερσίν.	1.463
λείπω, λείψω, ἔλιπον, λέλοιπα, λέλειμμαι	leave (behind), quit, forsake, abandon, desert	φύσει, ἐπεὶ δὴ πρῶτα τομὴν ἐν ὄρεσσι λέλοιπεν,	1.235
λέπω*, λέψω, ἔλεψα	strip, peel, scale	οὐδ' ἀναθηλήσει: περὶ γάρ ῥά ἑ χαλκὸς ἔλεψε	1.236
λευκός, ή, όν	white, shining	οἳ δ' ἱστὸν στήσαντ' ἀνά θ' ἱστία λευκὰ πέτασσαν,	1.480
λευκώλενος, ον	white-armed	τῷ γὰρ ἐπὶ φρεσὶ θῆκε θεὰ λευκώλενος Ἥρη:	1.55
λεύσσω	see, behold, observe, look (at)	λεύσσετε γὰρ τό γε πάντες ὅ μοι γέρας ἔρχεται ἄλλῃ.	1.120
λέχος, εος, τό	bed, couch	ἱστὸν ἐποιχομένην καὶ ἐμὸν λέχος ἀντιόωσαν:	1.31
λήγω, λήξω, ἔληξα	cease (from), refrain	ἀλλ' ἄγε λῆγ' ἔριδος, μηδὲ ξίφος ἕλκεο χειρί:	1.210
λήθη, ης, ἡ	forgetting, forgetfulness	ἐκ Διός: ἀλλὰ σὺ σῇσιν ἔχε φρεσί, μηδέ σε λήθη	2.33
λήθω	(with gen) escape the notice, be hidden; mid: forget	πάντες ἅμα, Ζεὺς δ' ἦρχε: Θέτις δ' οὐ λήθετ' ἐφετμέων	1.495
λήιον, -ου, τό	crop, field	ὡς δ' ὅτε κινήσῃ Ζέφυρος βαθὺ λήϊον ἐλθὼν	2.147
Λητώ, Λητόος (Λητοῦς)	Leto		
λιάζομαι, --, ἐλίασσα, --, --, ἐλιάσθην	bend, turn aside, sink, fall	δακρύσας ἑτάρων ἄφαρ ἕζετο νόσφι λιασθείς,	1.349
λιγύς, εῖα, ύ	shrill, clear-toned	ἡδυεπὴς ἀνόρουσε λιγὺς Πυλίων ἀγορητής,	1.248
λιγύφθογγος, ον	clear-voiced (of heralds)	αὐτὰρ ὃ κηρύκεσσι λιγυφθόγγοισι κέλευσε	2.50
λίην	exceedingly, very, especially	καὶ λίην σε πάρος γ' οὔτ' εἴρομαι οὔτε μεταλλῶ,	1.553
λιμήν, ένος, ὁ	harbour, anchoring place	οἳ δ' ὅτε δὴ λιμένος πολυβενθέος ἐντὸς ἵκοντο	1.432
λιπαρός, ά, όν	oily, bright, brilliant	ποσσὶ δ' ὑπὸ λιπαροῖσιν ἐδήσατο καλὰ πέδιλα,	2.44
λίσσομαι (λιτ-), --, ἐλ(λ)ισάμην (ἐλιτόμην)	beg, entreat	χρυσέῳ ἀνὰ σκήπτρῳ, καὶ λίσσετο πάντας Ἀχαιούς,	1.15
λοίγιος, η, ον	dreadful, accursed, horrible, nasty, deadly	ἦ δὴ λοίγια ἔργ' ὅ τέ μ' ἐχθοδοπῆσαι ἐφήσεις	1.518
λοιγός, οῦ, ὁ	destruction, ruin, death, curse	βούλεται ἀντιάσας ἡμῖν ἀπὸ λοιγὸν ἀμῦναι.	1.67
λοιμός, οῦ, ὁ	plague, pest(ilence)	εἰ δὴ ὁμοῦ πόλεμός τε δαμᾷ καὶ λοιμὸς Ἀχαιούς:	1.61
λόχος, ου, ὁ	ambush, ambuscade	οὔτε λόχον δ' ἰέναι σὺν ἀριστήεσσιν Ἀχαιῶν	1.227
λῦμα, ατος, τό	offscouring, filth	οἳ δ' ἀπελυμαίνοντο καὶ εἰς ἅλα λύματα βάλλον,	1.314
λύω, λύσω, ἔλυσα	loose, free, break up, destroy	λυσόμενός τε θύγατρα φέρων τ' ἀπερείσι' ἄποινα,	1.13
λωβάομαι*, λωβήσομαι*, ἐλωβησάμην	insult, revile, act arrogantly, outrage, ruin, wrong	ἦ γὰρ ἂν Ἀτρεΐδη νῦν ὕστατα λωβήσαιο.	1.232
λωβητήρ, ῆρος, ὁ/ἡ	slanderer, wretch	ὃς τὸν λωβητῆρα ἐπεσβόλον ἔσχ' ἀγοράων.	2.275
λωίων, ον	superior, better (comparative of ἀγαθός)	ἦ πολὺ λώϊόν ἐστι κατὰ στρατὸν εὐρὺν Ἀχαιῶν	1.229
μά	adv. of swearing; surely, verily, by	οὐ μὰ γὰρ Ἀπόλλωνα Διῒ φίλον, ᾧ τε σὺ Κάλχαν	1.86
μάκαρ, αρος	blessed, happy, fortunate, lucky	πρός τε θεῶν μακάρων πρός τε θνητῶν ἀνθρώπων	1.339
μακρός, ή, όν	long, high, lofty, large, distant	ὦχ' ἑκατόγχειρον καλέσασ' ἐς μακρὸν Ὄλυμπον,	1.402
μάλα	very, exceedingly, even, by all means, much, enough	θαρσήσας μάλα εἰπὲ θεοπρόπιον ὅ τι οἶσθα:	1.85
μαλακός, η, ον	soft, gentle, tender, mild	ἀλλὰ σὺ τὸν ἐπέεσσι καθάπτεσθαι μαλακοῖσιν:	1.582
μάλιστα	most, especially, by all means	Ἀτρεΐδα δὲ μάλιστα δύω, κοσμήτορε λαῶν:	1.16
μᾶλλον [μάλα]	more, rather, preferably	μᾶλλον ἐμοὶ ἔσεαι: τὸ δέ τοι καὶ ῥίγιον ἔσται.	1.563
μαντεύομαι, μαντεύσομαι, ἐμαντευσάμην	predict, prophesy, divine	αἰεί τοι τὰ κάκ' ἐστὶ φίλα φρεσὶ μαντεύεσθαι,	1.107
μάντις, ιος, ὁ	seer, prophet, soothsayer	ἀλλ' ἄγε δή τινα μάντιν ἐρείομεν ἢ ἱερῆα	1.62
μαντοσύνη, ης, ἡ	gift of prophecy	ἣν διὰ μαντοσύνην, τήν οἱ πόρε Φοῖβος Ἀπόλλων:	1.72
μάρναμαι	strive, fight, contend	εἰ σφῶϊν τάδε πάντα πυθοίατο μαρναμένοιϊν,	1.257
μάρτυρος, ου, ὁ	witness	καί σφωϊν δὸς ἄγειν: τὼ δ' αὐτὼ μάρτυροι ἔστων	1.338
μαχέομαι (μάχομαι), μαχήσομαι (μαχέομαι), ἐμαχεσ(σ)άμην	fight, battle	τίς τ' ἄρ σφωε θεῶν ἔριδι ξυνέηκε μάχεσθαι;	1.8
μάχη, ης, ἡ	battle, fight, fray	αἰεὶ γάρ τοι ἔρις τε φίλη πόλεμοί τε μάχαι τε:	1.177
μάψ	in vain, without result	μὰψ οὕτω τοιόνδε τοσόνδε τε λαὸν Ἀχαιῶν	2.120
μεγάθυμος, η, ον	great-souled, brave	πῶς γάρ τοι δώσουσι γέρας μεγάθυμοι Ἀχαιοί;	1.123
μέγαρον, ου, τό	great hall; plural: palace	πολλάκι γάρ σεο πατρὸς ἐνὶ μεγάροισιν ἄκουσα	1.396
μέγας, μεγάλη, μέγα	great, large, tall, mighty	ἀχνύμενος: μένεος δὲ μέγα φρένες ἀμφιμέλαιναι	1.103
μέγεθος, εος, τό	greatness, stature	εἶδός τε μέγεθός τε φυήν τ' ἄγχιστα ἐῴκει:	2.58
μέγιστος, η, ον	largest, mightiest (superlative of μέγας)	ἠδ' ἔτι καὶ λύσει: τοῦ γὰρ κράτος ἐστὶ μέγιστον.	2.118
μέδων, οντος, ὁ	lord, ruler	ὦ φίλοι Ἀργείων ἡγήτορες ἠδὲ μέδοντες	2.79
μεθήμων, -ονος	remiss, careless	ἀλλὰ μάλ' οὐκ Ἀχιλῆϊ χόλος φρεσίν, ἀλλὰ μεθήμων:	2.241
