ὅτ(τ)ι	that, because, why	κήδετο γὰρ Δαναῶν, ὅτι ῥα θνήσκοντας ὁρᾶτο.	1.56
ὅτε	when(ever)	κρείσσων γὰρ βασιλεὺς ὅτε χώσεται ἀνδρὶ χέρηϊ:	1.80
ὀτρηρός, ή, όν	ready, eager, nimble, swift	τώ οἱ ἔσαν κήρυκε καὶ ὀτρηρὼ θεράποντε:	1.321
ὀτρύνω, ὀτρυνέω, ὄτρυνα	stir up, encourage, quicken	ὀτρύνουσ' ἰέναι Διὸς ἄγγελος: οἳ δ' ἀγέροντο.	2.94
οὐ, οὐκ, οὐχ	not, no	ἀλλ' οὐκ Ἀτρεΐδῃ Ἀγαμέμνονι ἥνδανε θυμῷ,	1.24
οὐδέ	not even, and not, nor, but not	συμπάντων Δαναῶν, οὐδ' ἢν Ἀγαμέμνονα εἴπῃς,	1.90
οὐδείς, οὐδεμία, οὐδέν	no one, not any, none, nothing	χωόμενος ὅ τ' ἄριστον Ἀχαιῶν οὐδὲν ἔτισας.	1.244
οὐλόμενος	destructive	οὐλομένην, ἣ μυρί' Ἀχαιοῖς ἄλγε' ἔθηκε,	1.2
οὖλος, η, ον, = ὀλοός	destructive, baneful, cruel	πέμψαι ἐπ' Ἀτρεΐδῃ Ἀγαμέμνονι οὖλον ὄνειρον:	2.6
οὐλοχύτη, ης, ἡ	poured-out barleycorn	χερνίψαντο δ' ἔπειτα καὶ οὐλοχύτας ἀνέλοντο.	1.449
οὖν	therefore, hence, now, in fact	οἳ δ' ἐπεὶ οὖν ἤγερθεν ὁμηγερέες τε γένοντο,	1.57
οὕνεκα (οὗ-ἔνεκα)	because	οὕνεκα τὸν Χρύσην ἠτίμασεν ἀρητῆρα	1.11
Οὐρανίων, ωνος, ὁ, ἡ	dweller of heaven, divinity, god(dess)		
οὐρανός, οῦ, ὁ	heaven, sky	οὐρανόθεν: πρὸ γὰρ ἧκε θεὰ λευκώλενος Ἥρη	1.195
οὐρεύς, οὐρῆος, ὁ	mule	οὐρῆας μὲν πρῶτον ἐπῴχετο καὶ κύνας ἀργούς,	1.50
οὖρος (ὄρος), εος, τό	mountain	οὔρεά τε σκιόεντα θάλασσά τε ἠχήεσσα:	1.157
οὐρός, -ού, ὁ	launching-trench	οὐρούς τ' ἐξεκάθαιρον: ἀϋτὴ δ' οὐρανὸν ἷκεν	2.153
οὖρος, ου, ὁ	breeze, wind	τοῖσιν δ' ἴκμενον οὖρον ἵει ἑκάεργος Ἀπόλλων:	1.479
οὔτε, οὔτε... οὔτε	and not, nor; either... or	οὔτέ ποτ' ἐς πόλεμον ἅμα λαῷ θωρηχθῆναι	1.226
οὐτιδανός, ή, όν	worthless, of no account, cowardly, feeble	δημοβόρος βασιλεὺς ἐπεὶ οὐτιδανοῖσιν ἀνάσσεις:	1.231
οὗτος, αὕτη, τοῦτο	that (one)	ἧος ὃ ταῦθ' ὥρμαινε κατὰ φρένα καὶ κατὰ θυμόν,	1.193
οὕτω (οὕτως)	thus, so, in this way (ou-)	μὴ δ' οὕτως ἀγαθός περ ἐὼν θεοείκελ' Ἀχιλλεῦ	1.131
ὀφείλω (ὀφέλλω), ὀφειλήσω*, ὤφελον	owe, ought, be obligated; (in wishes) would that!	τιμήν πέρ μοι ὄφελλεν Ὀλύμπιος ἐγγυαλίξαι	1.353
ὀφέλλω	increase, magnify, exalt, swell	υἱὸν ἐμὸν τίσωσιν ὀφέλλωσίν τέ ἑ τιμῇ.	1.510
ὀφθαλμός, οῦ, ὁ	eye, sight	μή σε φίλην περ ἐοῦσαν ἐν ὀφθαλμοῖσιν ἴδωμαι	1.587
ὄφρα	until, in order that (with subjunct), while	ἀλλά τε καὶ μετόπισθεν ἔχει κότον, ὄφρα τελέσσῃ,	1.82
ὀφρύς, ύος, ἡ	(eye)brow	ἦ καὶ κυανέῃσιν ἐπ' ὀφρύσι νεῦσε Κρονίων:	1.528
ὄχα	(by) far, much, considerably	Κάλχας Θεστορίδης οἰωνοπόλων ὄχ' ἄριστος,	1.69
ὀχθέω, --, ὤχθησα	be vexed, be displeased, be worried	τὴν δὲ μέγ' ὀχθήσας προσέφη νεφεληγερέτα Ζεύς:	1.517
ὄψ, ὀπός, ἡ	voice, word, speech, language	Μουσάων θ' αἳ ἄειδον ἀμειβόμεναι ὀπὶ καλῇ.	1.604
ὄψιμος, ον	slow, late, recent	ὄψιμον ὀψιτέλεστον, ὅου κλέος οὔ ποτ' ὀλεῖται.	2.325
ὀψιτέλεστος, ον	late in fulfilment	ὄψιμον ὀψιτέλεστον, ὅου κλέος οὔ ποτ' ὀλεῖται.	2.325
π(τ)ολεμίζω, π(τ)ολεμίξω	wage war, fight	ἔρχομ' ἔχων ἐπὶ νῆας, ἐπεί κε κάμω πολεμίζων.	1.168
π(τ)όλεμος, ου, ὁ	war, battle, fray	εἰ δὴ ὁμοῦ πόλεμός τε δαμᾷ καὶ λοιμὸς Ἀχαιούς:	1.61
π(τ)όλις, ιος (ηος), ἡ	city, state	ἐκπέρσαι Πριάμοιο πόλιν, εὖ δ' οἴκαδ' ἱκέσθαι:	1.19
παιήων, ονος, ὁ	paean, song of praise	καλὸν ἀείδοντες παιήονα κοῦροι Ἀχαιῶν	1.473
παῖς, παιδός, ὁ, ἡ	child	παῖδα δ' ἐμοὶ λύσαιτε φίλην, τὰ δ' ἄποινα δέχεσθαι,	1.20
παλάμη, ης, ἡ	palm (of hand), hand, fist	ἐν παλάμῃς φορέουσι δικασπόλοι, οἵ τε θέμιστας	1.238
παλίλλογος, η, ον	gathered together again, re-collected, re-assembled	λαοὺς δ' οὐκ ἐπέοικε παλίλλογα ταῦτ' ἐπαγείρειν.	1.126
πάλιν	back, backward(s), again, anew	Ἀτρεΐδη νῦν ἄμμε παλιμπλαγχθέντας ὀΐω	1.59
παλινάγρετος, η, ον	revocable, to be taken back	τέκμωρ: οὐ γὰρ ἐμὸν παλινάγρετον οὐδ' ἀπατηλὸν	1.526
Παλλάς, άδος, ἡ	Pallas (Athena)		
πάμπαν	completely, altogether	μήνι' Ἀχαιοῖσιν, πολέμου δ' ἀποπαύεο πάμπαν:	1.422
Παναχαιοί, ῶν, οἱ	all the Achaeans	κίκλησκεν δὲ γέροντας ἀριστῆας Παναχαιῶν,	2.404
πανημέριος, η, ον	all day long	οἳ δὲ πανημέριοι μολπῇ θεὸν ἱλάσκοντο	1.472
παννύχιος, ον	all night long	εὗδον παννύχιοι, Δία δ' οὐκ ἔχε νήδυμος ὕπνος,	2.2
πανσυδίῃ	with all speed	πανσυδίῃ: νῦν γάρ κεν ἕλοι πόλιν εὐρυάγυιαν	2.12
πάντῃ	everywhere, throughout	πάντῃ ἀνὰ στρατὸν εὐρὺν Ἀχαιῶν: ἄμμι δὲ μάντις	1.384
παντοῖος, α, ον	of all sorts, manifold	παντοίων ἀνέμων, ὅτ' ἂν ἔνθ' ἢ ἔνθα γένωνται.	2.397
παρά, πάρ, παραί	from/by/to the side of, beside, along, near, stretched along	μή σε γέρον κοίλῃσιν ἐγὼ παρὰ νηυσὶ κιχείω	1.26
παράφημι, παραφήσω, παρέφησα*	advise, counsel, urge, persuade	μητρὶ δ' ἐγὼ παράφημι καὶ αὐτῇ περ νοεούσῃ	1.577
παρέζομαι	sit beside, sit near	τῶν νῦν μιν μνήσασα παρέζεο καὶ λαβὲ γούνων	1.407
πάρειμι, παρέσ(σ)ομαι	be present, be at hand, be near, be beside	καί ποτέ τοι τρὶς τόσσα παρέσσεται ἀγλαὰ δῶρα	1.213
παρείπον	(2nd aor) persuade, cajole, win over, urge, outwit, delude, beguile, talk over	νῦν δ' αἰνῶς δείδοικα κατὰ φρένα μή σε παρείπῃ	1.555
παρέρχομαι, παρελεύσομαι, παρῆλθον (παρήλυθον), παρελήλυθα	evade, pass by, outwit, elude, circumvent	κλέπτε νόῳ, ἐπεὶ οὐ παρελεύσεαι οὐδέ με πείσεις.	1.132
πάρημαι	sit beside	ἀλλὰ σὺ μὲν νῦν νηυσὶ παρήμενος ὠκυπόροισι	1.421
παρίστημι	cause to stand; arouse, inspire; (2nd aor.) stand by	τὸν δ' ἀγανοῖς ἐπέεσσιν ἐρητύσασκε παραστάς:	2.189
πάροιθε(ν)	in front of, before, formerly (with gen)	καί ῥα πάροιθ' αὐτοῖο καθέζετο δάκρυ χέοντος,	1.360
πάρος	formerly, of old, before this	ἦ μὲν δή ποτ' ἐμεῦ πάρος ἔκλυες εὐξαμένοιο,	1.453
πᾶς, πᾶσα, πᾶν	all, every, (the) whole	χρυσέῳ ἀνὰ σκήπτρῳ, καὶ λίσσετο πάντας Ἀχαιούς,	1.15
πατέομαι, --, ἐπασ(σ)άμην, --, πέπασμαι	eat, feed	αὐτὰρ ἐπεὶ κατὰ μῆρε κάη καὶ σπλάγχνα πάσαντο,	1.464
πατήρ, πατέρος (πατρός), ὁ	father, sire	πρίν γ' ἀπὸ πατρὶ φίλῳ δόμεναι ἑλικώπιδα κούρην	1.98
πάτρη, ης, ἡ	fatherland, native land	ἡμετέρῳ ἐνὶ οἴκῳ ἐν Ἄργεϊ τηλόθι πάτρης	1.30
πατρώιος, η, ον	of one's fathers, ancestral	εἵλετο δὲ σκῆπτρον πατρώϊον ἄφθιτον αἰεὶ	2.46
παῦρος, -ον	little, small, few	ἀνδράσι παυροτέροισι, τέλος δ' οὔ πώ τι πέφανται:	2.122
παυσωλή, ῆς, ἡ	rest	οὐ γὰρ παυσωλή γε μετέσσεται οὐδ' ἠβαιὸν	2.386
παύω, παύσω, ἔπαυσα, πέπαυκα*, πέπαυμαι, ἐπαύθην*	cease, stop, check, restrain, hold off	ἦε χόλον παύσειεν ἐρητύσειέ τε θυμόν.	1.192
πέδιλον, τό	sandal	ποσσὶ δ' ὑπὸ λιπαροῖσιν ἐδήσατο καλὰ πέδιλα,	2.44
πείθω, πείσω, ἔπεισα	persuade, win over, mislead	ὣς ἔφατ', ἔδεισεν δ' ὃ γέρων καὶ ἐπείθετο μύθῳ:	1.33
πειράω, πειρήσω, ἐπείρησα* (ἐπειρησάμην), πεπείρηκα*, πεπείρημαι, ἐπειρήθην	try, attempt	εἰ δ' ἄγε μὴν πείρησαι ἵνα γνώωσι καὶ οἵδε:	1.302
πείρω, --, ἔπειρα, --, πέπαρμαι	pierce, stud, rivet	χρυσείοις ἥλοισι πεπαρμένον, ἕζετο δ' αὐτός:	1.246
πελάζω, πελάσω*, ἐπέλασ(σ)α, --, πέπλημαι, ἐπελάσθην (ἐπλήμην)	bring near, draw near, approach	ἱστὸν δ' ἱστοδόκῃ πέλασαν προτόνοισιν ὑφέντες	1.434
πέλω, --, ἔπλε (ἔπλετο)	turn, move; mid: be, become	ἕρκος Ἀχαιοῖσιν πέλεται πολέμοιο κακοῖο.	1.284
πέλωρον, ου, τό	portent, monster	ὡς οὖν δεινὰ πέλωρα θεῶν εἰσῆλθ' ἑκατόμβας,	2.321
πέμπω, πέμψω, ἔπεμψα	send, escort, conduct	πέμψω, ἐγὼ δέ κ' ἄγω Βρισηΐδα καλλιπάρῃον	1.184
πεμπώβολον, ου, τό	five-pronged fork	λεῖβε: νέοι δὲ παρ' αὐτὸν ἔχον πεμπώβολα χερσίν.	1.463
πένθος, εος, τό	woe, grief, sadness	ὦ πόποι ἦ μέγα πένθος Ἀχαιΐδα γαῖαν ἱκάνει:	1.254
πένομαι	work, be busy, labour, do	ὣς οἳ μὲν τὰ πένοντο κατὰ στρατόν: οὐδ' Ἀγαμέμνων	1.318
πενταέτηρος, ον	five years old	πίονα πενταέτηρον ὑπερμενέϊ Κρονίωνι,	2.403
πέντε	five		
πέπρωται	it is fated		
πέπων, -ονος, ὁ	melon, gourd	ὦ πέπονες κάκ' ἐλέγχε' Ἀχαιΐδες οὐκέτ' Ἀχαιοὶ	2.235
πέρ	exceedingly, very, even (if), although (enclitic)	εἴ περ γάρ τε χόλον γε καὶ αὐτῆμαρ καταπέψῃ,	1.81
πέρθω, πέρσω, ἔπερσα/ἔπραθον*	ravage, destroy	χερσὶν ὑφ' ἡμετέρῃσιν ἁλοῦσά τε περθομένη τε.	2.374
περί	around, about, concerning, for, exceedingly, over, above, beyond...	οὐδ' ἀναθηλήσει: περὶ γάρ ῥά ἑ χαλκὸς ἔλεψε	1.236
περιέχω, περιέξω (περισχήσω), περίεσχον	protect, defend, encompass, embrace	ἀλλὰ σὺ εἰ δύνασαί γε περίσχεο παιδὸς ἑῆος:	1.393
περιίστημι	place around, (med.) stand round about	βοῦν δὲ περιστήσαντο καὶ οὐλοχύτας ἀνέλοντο:	2.410
περικαλλής, ές	very beautiful, charming	οὐ μὲν φόρμιγγος περικαλλέος ἣν ἔχ' Ἀπόλλων,	1.603
περικλυτός, ή, όν	famous, very renowned	ἧχι ἑκάστῳ δῶμα περικλυτὸς ἀμφιγυήεις	1.607
περιτροπέω	revolve, turn about	ἡμῖν δ' εἴνατός ἐστι περιτροπέων ἐνιαυτὸς	2.295
περιφραδέως	carefully	ὤπτησάν τε περιφραδέως, ἐρύσαντό τε πάντα.	1.466
περιχέω, --, περίχευα	pour, spread, scatter round, scatter over	εὕδοντ' ἐν κλισίῃ, περὶ δ' ἀμβρόσιος κέχυθ' ὕπνος.	2.19
πέσσω, πεφήσεται, ἔπεξα, *ἐπέφθην, *πέπεμμαι	ripen, cook, digest	αὐτοῦ ἐνὶ Τροίῃ γέρα πεσσέμεν, ὄφρα ἴδηται	2.237
πέταλον, ου, τό	leaf	ὄζῳ ἐπ' ἀκροτάτῳ πετάλοις ὑποπεπτηῶτες	2.312
πετάννυμι*, πετάσω*, ἐπέτασ(σ)α, --, πέπταμαι, ἐπετάσθην	stretch, spread (out), unfurl, expand	οἳ δ' ἱστὸν στήσαντ' ἀνά θ' ἱστία λευκὰ πέτασσαν,	1.480
πέτομαι	fly	βοτρυδὸν δὲ πέτονται ἐπ' ἄνθεσιν εἰαρινοῖσιν:	2.89
πέτρη, ης, ἡ	stone, rock, cave	πέτρης ἐκ γλαφυρῆς αἰεὶ νέον ἐρχομενάων,	2.88
πεύθομαι (πυνθάνομαι), πεύσομαι, ἐπυθόμην (πεπυθόμην), --, πέπυσμαι	learn (by enquiry)	εἰ σφῶϊν τάδε πάντα πυθοίατο μαρναμένοιϊν,	1.257
πῇ	in what way? how? to what end?	πῇ δὴ συνθεσίαι τε καὶ ὅρκια βήσεται ἥμιν;	2.339
Πηλεΐων, ονος, ὁ	Son of Peleus		
Πηληιάδης	Pelides		
πίμπλημι, πλήσω, ἔπλησα (ἐπλήμην)	fill, sate, stuff	πίμπλαντ', ὄσσε δέ οἱ πυρὶ λαμπετόωντι ἐΐκτην:	1.104
πίπτω, πεσέομαι, ἔπεσον, πέπτη(κ)α	fall, drop, die, perish, sink	θνήσκοντες πίπτωσι: σὺ δ' ἔνδοθι θυμὸν ἀμύξεις	1.243
πιστός, -ή, -όν	faithful, trusty, trustworthy	ὅρκια πιστὰ ταμόντες ἀριθμηθήμεναι ἄμφω,	2.124
πίων, πίειρα, πῖον	fat, rich	ἢ εἰ δή ποτέ τοι κατὰ πίονα μηρί' ἔκηα	1.40
πλάζω, πλάγξομαι, ἔπλαγξα, ἐπλάγχθην	turn aside, baffle, thwart	Ἀτρεΐδη νῦν ἄμμε παλιμπλαγχθέντας ὀΐω	1.59
πλατάνιστος, ου, ἡ	planetree	καλῇ ὑπὸ πλατανίστῳ ὅθεν ῥέεν ἀγλαὸν ὕδωρ:	2.307
πλεῖστος, η, ον	most (superlative of πολύς)		
πλείων, ον	more (comparative of πολύς)	ἀλλὰ τὸ μὲν πλεῖον πολυάϊκος πολέμοιο	1.165
πληγή -ῆς, ἡ	blow, stroke	πεπλήγων ἀγορῆθεν ἀεικέσσι πληγῇσιν.	2.264
πληθύς, -ύος, ἡ	throng, crowd	πᾶσι μετὰ πληθὺν ὅσοι οὐ βουλῆς ἐπάκουσαν:	2.143
πλήξιππος, ον	horse-driving	Ἑρμείας δὲ ἄναξ δῶκεν Πέλοπι πληξίππῳ,	2.104
πλήσιος, α, ον	near, neighbouring	ὧδε δέ τις εἴπεσκεν ἰδὼν ἐς πλησίον ἄλλον:	2.271
πλήσσω, πλήξω, ἔπληξα/πέπληγον, *πέπληγα, *πέπληγμαι, ἐπλήγην	to strike, beat	πεπλήγων ἀγορῆθεν ἀεικέσσι πληγῇσιν.	2.264
πλοῦτος, ου, ὁ	wealth, riches, abundance	ἐνθάδ' ἄτιμος ἐὼν ἄφενος καὶ πλοῦτον ἀφύξειν.	1.171
ποδάρκης, ες	swift-footed	τὸν δ' ἠμείβετ' ἔπειτα ποδάρκης δῖος Ἀχιλλεύς:	1.121
ποθέω, ποθήσω*, ἐπόθεσα	yearn, long for (what is lacking), desire, lack, miss	αὖθι μένων, ποθέεσκε δ' ἀϋτήν τε πτόλεμόν τε.	1.492
ποθή, ῆς, ἡ	yearning, longing, regret	ἦ ποτ' Ἀχιλλῆος ποθὴ ἵξεται υἷας Ἀχαιῶν	1.240
ποθί	ever, at any time (enclitic)	τριπλῇ τετραπλῇ τ' ἀποτείσομεν, αἴ κέ ποθι Ζεὺς	1.128
ποιέω, ποιήσω, ἐποίησα	do, make, perform, execute, cause, effect, fashion, build, produce	δίπτυχα ποιήσαντες, ἐπ' αὐτῶν δ' ὠμοθέτησαν:	1.461
ποιμήν, μένος, ὁ	shepherd, guardian, protector	οἷον Πειρίθοόν τε Δρύαντά τε ποιμένα λαῶν	1.263
ποῖος, η, ον	what (sort)? what kind?	αἰνότατε Κρονίδη ποῖον τὸν μῦθον ἔειπες;	1.552
ποιπνύω, --, ἐποίπνυσα	bustle, hurry, huff, pant	ὡς ἴδον Ἥφαιστον διὰ δώματα ποιπνύοντα.	1.600
πολιός, ή, όν	grey, hoary	θῖν' ἔφ' ἁλὸς πολιῆς, ὁρόων ἐπ' ἀπείρονα πόντον:	1.350
πολλάκι(ς)	often, many times	πολλάκι γάρ σεο πατρὸς ἐνὶ μεγάροισιν ἄκουσα	1.396
πολλός, ή, όν	much, many, numerous	πολλὰς δ' ἰφθίμους ψυχὰς Ἄϊδι προΐαψεν	1.3
πολυάιξ, ικος	impetuous, onrushing	ἀλλὰ τὸ μὲν πλεῖον πολυάϊκος πολέμοιο	1.165
πολύαρνος, ον	many-lambed, rich in flocks	Ἀτρεὺς δὲ θνῄσκων ἔλιπεν πολύαρνι Θυέστῃ,	2.106
πολυβενθής, ές	very deep	οἳ δ' ὅτε δὴ λιμένος πολυβενθέος ἐντὸς ἵκοντο	1.432
πολυδειράς, άδος	many-ridged, with many cliffs	ἀκροτάτῃ κορυφῇ πολυδειράδος Οὐλύμποιο:	1.499
πολύζυγος, ον	many-benched	ἀσχαλάᾳ σὺν νηῒ πολυζύγῳ, ὅν περ ἄελλαι	2.293
πολυκλήις, ιδος	with many benches	καὶ φεύγειν σὺν νηυσὶ πολυκλήϊσι κελεύσω:	2.74
πολυκοιρανίη, -ης, ἡ	rule of many	οὐκ ἀγαθὸν πολυκοιρανίη: εἷς κοίρανος ἔστω,	2.204
πολύμητις	wily, rich in counsel	εἷσεν ἄγων: ἐν δ' ἀρχὸς ἔβη πολύμητις Ὀδυσσεύς.	1.311
πολυμήχανος, -ον	resourceful, inventive	διογενὲς Λαερτιάδη πολυμήχαν' Ὀδυσσεῦ,	2.173
πολύστονος, η, ον	causing many a groan, rich in groans	ὃς νῦν Ἀργείοισι πολύστονα κήδε' ἐφῆκεν.	1.445
πολύφλοισβος	loud-roaring, heavy-thundering	βῆ δ' ἀκέων παρὰ θῖνα πολυφλοίσβοιο θαλάσσης:	1.34
πονέω	work hard, toil, suffer	ᾔδεε γὰρ κατὰ θυμὸν ἀδελφεὸν ὡς ἐπονεῖτο.	2.409
πόνος, ου, ὁ	work, labour, toil, trouble	αὐτὰρ ἐπεὶ παύσαντο πόνου τετύκοντό τε δαῖτα	1.467
ποντοπόρος, ον	sea-going, sea-traversing, crossing the sea	ἐκ δὲ Χρυσηὶς νηὸς βῆ ποντοπόροιο.	1.439
πόντος, ου, ὁ	sea (literally: path)	θῖν' ἔφ' ἁλὸς πολιῆς, ὁρόων ἐπ' ἀπείρονα πόντον:	1.350
πόποι	alas! ah me! O dear! good gracious!	ὦ πόποι ἦ μέγα πένθος Ἀχαιΐδα γαῖαν ἱκάνει:	1.254
πόρον (ἔπορον)	gave, granted, furnished, bestowed (2nd aor)	ἣν διὰ μαντοσύνην, τήν οἱ πόρε Φοῖβος Ἀπόλλων:	1.72
πορφύρεος, η, ον	dark (red), purple, violet, glistening	στείρῃ πορφύρεον μεγάλ' ἴαχε νηὸς ἰούσης:	1.482
πόσις, ιος, ἡ	drink(ing)	αὐτὰρ ἐπεὶ πόσιος καὶ ἐδητύος ἐξ ἔρον ἕντο,	1.469
ποτάομαι	fly hither and thither	αἳ μέν τ' ἔνθα ἅλις πεποτήαται, αἳ δέ τε ἔνθα:	2.90
ποτέ	ever, at any (some) time, once (enclitic)	Σμινθεῦ εἴ ποτέ τοι χαρίεντ' ἐπὶ νηὸν ἔρεψα,	1.39
ποτιδέγμενος	(pres. ppl. from προσδέχομαι), expecting, awaiting	εἵατ' ἐνὶ μεγάροις ποτιδέγμεναι: ἄμμι δὲ ἔργον	2.137
πότμος, ὁ	death, doom, destiny	ὄφρα πρόσθ' ἄλλων θάνατον καὶ πότμον ἐπίσπῃ.	2.359
πότνια, ης, ἡ	revered, honoured (lady, queen)	ὣς φάτο δάκρυ χέων, τοῦ δ' ἔκλυε πότνια μήτηρ	1.357
ποτόν, οῦ, τό	drink(ing)	κοῦροι μὲν κρητῆρας ἐπεστέψαντο ποτοῖο,	1.470
πού	any way, anywhere, some way, somewhere, somehow, perhaps (enclitic)	οὐδέ τί που ἴδμεν ξυνήϊα κείμενα πολλά:	1.124
πούς, ποδός, ὁ	foot	τοῖσι δ' ἀνιστάμενος μετέφη πόδας ὠκὺς Ἀχιλλεύς:	1.58
πραπίς, ίδος, ἡ	heart, mind, soul, diaphragm, disposition	Ἥφαιστος ποίησεν ἰδυίῃσι πραπίδεσσι:	1.608
πρήθω, πρήσω, ἔπρησα	blow, burn, inflate	ἐν δ' ἄνεμος πρῆσεν μέσον ἱστίον, ἀμφὶ δὲ κῦμα	1.481
πρηνής, ές	face down, lying forwards	πρίν με κατὰ πρηνὲς βαλέειν Πριάμοιο μέλαθρον	2.414
πρήσσω, πρήξω, ἔπρηξα	carry through, do, act, perform	πρῆξαι δ' ἔμπης οὔ τι δυνήσεαι, ἀλλ' ἀπὸ θυμοῦ	1.562
Πρίαμος, ου, ὁ	Priam		
πρίν	sooner, until, before, formerly	τὴν δ' ἐγὼ οὐ λύσω: πρίν μιν καὶ γῆρας ἔπεισιν	1.29
πρό	before, in front, forth, forward (adv, and prep with gen)		
προβάλλω, προβαλέω, προέβαλον, προβέβληκα, προβέβλημαι	cast, throw forward	αὐτὰρ ἐπεί ῥ' εὔξαντο καὶ οὐλοχύτας προβάλοντο,	1.458
προβλής, ῆτος	thrown forwad, jutting out	προβλῆτι σκοπέλῳ: τὸν δ' οὔ ποτε κύματα λείπει	2.396
προβούλομαι, προβουλήσομαι*, --	prefer, wish (for something) rather than (another thing)	οἴκοι ἔχειν: καὶ γάρ ῥα Κλυταιμνήστρης προβέβουλα	1.113
προερέσσω, προήρεσ(σ)α	row forward	καρπαλίμως, τὴν δ' εἰς ὅρμον προέρεσσαν ἐρετμοῖς.	1.435
προερύω, προερύω, προείρυσ(σ)α, --, προείρυ(σ)μαι	draw forward, drag forward, launch	Ἀτρεΐδης δ' ἄρα νῆα θοὴν ἅλα δὲ προέρυσσεν,	1.308
προϊάπτω, προϊάψω, προΐαψα	hurl forward, send forth	πολλὰς δ' ἰφθίμους ψυχὰς Ἄϊδι προΐαψεν	1.3
προΐημι, προήσω, προέηκα (προῆκα)	send forward, send forth, give up	ἀλλὰ σὺ μὲν νῦν τήνδε θεῷ πρόες: αὐτὰρ Ἀχαιοὶ	1.127
προπάροιθε	before, in front of	ἠϊόνος προπάροιθε βαθείης ἐστιχόωντο	2.92
πρόπας, ασα, αν	all, entire, whole	ὣς τότε μὲν πρόπαν ἦμαρ ἐς ἠέλιον καταδύντα	1.601
πρός (προτί, ποτί)	to, toward, also, at on, from, on behalf of (gen, dat, acc); from, before, at the bidding, in the sight (gen); on, at by (dat); to, toward, (up)on, against (acc)	πρὸς Τρώων: τῶν οὔ τι μετατρέπῃ οὐδ' ἀλεγίζεις:	1.160
πρόσ(σ)ω	forward, in front	οὐδέ τι οἶδε νοῆσαι ἅμα πρόσσω καὶ ὀπίσσω,	1.343
προσαμύνω	come to the aid of	ἤ ῥά τί οἱ χἠμεῖς προσαμύνομεν ἦε καὶ οὐκί:	2.238
προσαυδάω, προσαυδήσω*, προσηύδησα	address, speak to, say to	καί μιν φωνήσας ἔπεα πτερόεντα προσηύδα:	1.201
προσέειπον	spoke to, addressed (2nd aorist)	Κάλχαντα πρώτιστα κάκ' ὀσσόμενος προσέειπε:	1.105
πρόσθε(ν)	before, formerly, sooner	ἐφθίαθ', οἵ οἱ πρόσθεν ἅμα τράφεν ἠδ' ἐγένοντο	1.251
πρόσφημι, προσφήσω, προσέφησα*	speak to, address (with acc)	τὸν δ' ἀπαμειβόμενος προσέφη κρείων Ἀγαμέμνων:	1.130
